Frogs and butterflies look very different from when they are born. The changes they go through are called (A) skipping. (B) metamorphosis. (C) fading. (D) breathing.	5	Frogs,5|and,0|butterflies,5|look,1|very,0|different,2|from,0|when,0|they,0|are,0|born.,2|The,0|changes,5|they,0|go,0|through,0|are,0|called,3
Cells contain genetic material called ___. (A) HIV (B) RNA (C) RPM (D) DNA	5	Cells,5|contain,0|genetic,5|material,4|called,1|___.,0
Changes in weather are caused by ___. (A) movement of air (B) the Earth's tilt on its axis (C) the Sun's orbit (D) consistent temperatures	5	Changes,5|in,0|weather,5|are,0|caused,4|by,0|___.,0
Which of the following is a harmful waste material that leaves the blood and travels through the lungs before leaving the body? (A) CO2. (B) O2. (C) H2O. (D) NaCl.	5	Which,0|of,0|the,0|following,0|is,0|a,0|harmful,4|waste,5|material,1|that,0|leaves,3|the,0|blood,5|and,0|travels,2|through,0|the,0|lungs,5|before,0|leaving,2|the,0|body?,3
Which characteristic applies to animals in only one of these taxonomic groups: reptiles, mammals, birds, amphibians, or fishes? 	5	Which,0|characteristic,5|applies,2|to,0|animals,2|in,0|only,0|one,4|of,0|these,0|taxonomic,4|groups:,5|reptiles,,3|mammals,,3|birds,,3|amphibians,,3|or,0|fishes?,3
To change an object from a solid to a liquid you must (A) increase the temperature. (B) decrease the temperature. (C) increase the volume. (D) decrease the volume.	5	To,0|change,4|an,0|object,3|from,0|a,0|solid,5|to,0|a,0|liquid,5|you,0|must,0
What form of energy is being used when a person pushes a wooden block across the floor? (A) mechanical (B) magnetic (C) sound (D) electrical	5	What,0|form,0|of,0|energy,5|is,0|being,0|used,0|when,0|a,0|person,2|pushes,5|a,0|wooden,1|block,5|across,1|the,0|floor?,3
Different species compete for different things. A cactus is most likely to compete for ___. (A) heat (B) water (C) space (D) oxygen	5	Different,1|species,1|compete,0|for,0|different,1|things.,1|A,0|cactus,5|is,0|most,0|likely,2|to,0|compete,5|for,0|___.,1
What form of energy causes an ice cube to melt? (A) mechanical (B) magnetic (C) sound (D) heat	5	What,0|form,0|of,0|energy,5|causes,1|an,0|ice,5|cube,2|to,0|melt?,5
A female dog is having puppies. She has black fur, brown eyes, and a curly tail. She can sit, bark, and roll over on command. Which set of traits can the female dog's puppies inherit? (A) brown eyes, black fur (B) fur, roll over on command (C) brown eyes, sit on command (D) bark on command, curly tail	5	A,0|female,2|dog,3|is,0|having,0|puppies.,1|She,0|has,0|black,3|fur,,3|brown,3|eyes,,3|and,0|a,0|curly,3|tail.,3|She,0|can,0|sit,,3|bark,,3|and,0|roll,3|over,0|on,0|command.,0|Which,0|set,0|of,0|traits,5|can,1|the,0|female,0|dog's,2|puppies,4|inherit?,5
The two functions of the roots are (A) support and reproduction. (B) food-making factory and anchor. (C) reproduction and transport. (D) anchor and absorb.	5	The,0|two,2|functions,5|of,0|the,0|roots,5|are,0
Which of these dissolve in water?    (A) Sand grains (B) Sugar cubes (C) Plastic straws (D) Wooden spoons	5	Which,0|of,0|these,0|dissolve,5|in,0|water?,5
Which disease is a result of abnormal cell division? (1) AIDS (2) cancer (3) chicken pox (4) common cold	5	Which,0|disease,5|is,0|a,0|result,1|of,0|abnormal,5|cell,5|division?,5
Which of the following is most likely a learned behavior? (A) using a fork to eat (B) jumping at a loud noise (C) squinting in a bright light (D) sneezing when smelling a flower	5	Which,0|of,0|the,0|following,1|is,0|most,0|likely,0|a,0|learned,5|behavior?,5
Which unit can be used to describe an object's length? (A) grams (B) minutes (C) liters (D) meters	5	Which,0|unit,5|can,0|be,0|used,0|to,0|describe,4|an,0|object's,4|length?,5
Trevor takes his radio to the beach. He uses batteries to supply energy. The energy transformation occurring is ___. (A) sound to heat and chemical (B) electrical to chemical and some heat (C) chemical to heat with a small amount of sound (D) chemical to sound and some heat	5	Trevor,1|takes,0|his,0|radio,2|to,0|the,0|beach.,1|He,0|uses,0|batteries,4|to,0|supply,2|energy.,3|The,0|energy,4|transformation,4|occurring,2|is,0|___.,0
During which process does a caterpillar become a butterfly? (1) fertilization (2) metamorphosis (3) asexual reproduction (4) biological adaptation	5	During,0|which,0|process,2|does,0|a,0|caterpillar,5|become,3|a,0|butterfly?,5
Which of the following is a factor that will cause different species to compete less? (A) Lack of space (B) Lack of resources (C) A change in the climate (D) A large supply of resources	5	Which,0|of,0|the,0|following,0|is,0|a,0|factor,3|that,0|will,0|cause,1|different,2|species,5|to,0|compete,5|less?,5
Which statement best describes the energy transformations that occur when a candle burns?	5	Which,0|statement,1|best,0|describes,2|the,0|energy,5|transformations,5|that,0|occur,0|when,0|a,0|candle,5|burns?,5
All known living things are made up of ___. (A) eggs (B) cells (C) cell walls (D) gelatin	5	All,0|known,1|living,5|things,5|are,0|made,4|up,0|of,0|___.,0
Algae are organisms that live in water. Scientists discovered a new type of red algae near Knight Island in Prince William Sound. Which statement is most likely a positive effect of this discovery?    (A) Scientists studying the red algae are disturbing local wildlife. (B) The red algae may help scientists better understand local food webs. (C) Visitors to Alaska may want to collect the red algae and take it home. (D) The red algae may be moved by boat to other areas when people travel.	5	Algae,2|are,0|organisms,1|that,0|live,1|in,0|water.,1|Scientists,1|discovered,3|a,0|new,4|type,3|of,0|red,3|algae,3|near,0|Knight,0|Island,0|in,0|Prince,0|William,0|Sound.,0|Which,0|statement,3|is,0|most,0|likely,0|a,0|positive,5|effect,5|of,0|this,0|discovery?,2
As more people have moved to the beach, the sea turtle population has decreased. Which is most likely the cause of this decrease? (A) tropical storms (B) increase in predators (C) habitat loss (D) warmer temperatures	5	As,0|more,0|people,4|have,0|moved,3|to,0|the,0|beach,,3|the,0|sea,4|turtle,5|population,4|has,0|decreased.,4|Which,0|is,0|most,0|likely,1|the,0|cause,4|of,0|this,0|decrease?,2
Which substance is found in nature as a solid, liquid, and gas? (A) wood (B) rocks (C) water (D) metal	5	Which,0|substance,5|is,0|found,1|in,0|nature,4|as,0|a,0|solid,,5|liquid,,5|and,0|gas?,5
If wolves prey on deer for food, what will most likely happen to the deer population if wolves are removed from an area where deer live? 	5	If,0|wolves,3|prey,2|on,0|deer,3|for,0|food,,1|what,0|will,0|most,0|likely,0|happen,1|to,0|the,0|deer,4|population,4|if,0|wolves,5|are,0|removed,4|from,0|an,0|area,1|where,0|deer,0|live?,0
In humans, a trait can be determined by one pair or many pairs of (1) genes (2) microbes (3) cells (4) organs	5	In,0|humans,,4|a,0|trait,5|can,1|be,0|determined,4|by,0|one,3|pair,1|or,0|many,2|pairs,2|of,0
An ecosystem is best described as having ___. (A) nonliving factors, only (B) living factors, only (C) living and nonliving factors (D) physical factors, only	5	An,0|ecosystem,5|is,0|best,0|described,2|as,0|having,0|___.,0
Genes are found in (A) hair. (B) cells. (C) air. (D) teeth.	5	Genes,5|are,0|found,4|in,0
A baby can inherit a trait from a (A) teacher. (B) neighbor. (C) parent. (D) friend.	5	A,0|baby,4|can,0|inherit,5|a,0|trait,5|from,0|a,0
When is a human considered to have reached the adult stage? (A) When cells no longer divide (B) When the human has begun to talk (C) When the human has begun to walk (D) When most growth has stopped	5	When,0|is,0|a,0|human,5|considered,1|to,0|have,0|reached,3|the,0|adult,5|stage?,4
Naomi has a pet dog. Which of the following characteristics did the dog most likely inherit from its parents? (A) its weight (B) its favorite food (C) the color of its fur (D) the place where it lives	5	Naomi,0|has,0|a,0|pet,0|dog.,0|Which,0|of,0|the,0|following,0|characteristics,4|did,0|the,0|dog,3|most,0|likely,0|inherit,5|from,0|its,0|parents?,4
Copper wire used to conduct electricity is covered in plastic, which is a(an) (A) protector. (B) accelerator. (C) insulator. (D) coloring.	5	Copper,3|wire,5|used,0|to,0|conduct,4|electricity,4|is,0|covered,4|in,0|plastic,,5|which,0|is,0|a(an),2
A student reaches one hand into a bag filled with smooth objects. The student feels the objects but does not look into the bag. Which property of the objects can the student most likely identify? (A) shape (B) color (C) ability to reflect light (D) ability to conduct electricity	5	A,0|student,0|reaches,0|one,0|hand,1|into,0|a,0|bag,1|filled,0|with,0|smooth,2|objects.,2|The,0|student,0|feels,3|the,0|objects,2|but,0|does,0|not,0|look,1|into,0|the,0|bag.,0|Which,0|property,5|of,0|the,0|objects,2|can,1|the,0|student,1|most,0|likely,0|identify?,5
Which characteristic is not inherited? (A) how tall you are (B) having brown eyes (C) being able to read a book (D) having blond hair	5	Which,0|characteristic,5|is,0|not,0|inherited?,4
Which motion takes the shortest amount of time? (A) The Earth revolves once around the Sun. (B) The Earth rotates once on its axis. (C) The Moon revolves once around the Earth. (D) The Sun rises, moves across the Earth's sky, and sets once.	5	Which,0|motion,3|takes,1|the,0|shortest,4|amount,0|of,0|time?,4
Andy lives in the southern hemisphere. What season does he most likely experience in August? (A) spring (B) summer (C) winter (D) autumn	5	Andy,0|lives,0|in,0|the,0|southern,5|hemisphere.,5|What,0|season,5|does,0|he,0|most,0|likely,1|experience,0|in,0|August?,5
Heather designed an investigation to see if the sunlight makes water temperature increase. What should she do first? (A) Make sure that it is not a cloudy day (B) Measure the temperature of the water before placing it in the Sun (C) Make sure that the thermometer is working correctly (D) Use a stopwatch to determine how long it will take for the temperature to change	5	Heather,0|designed,0|an,0|investigation,4|to,0|see,0|if,0|the,0|sunlight,5|makes,2|water,5|temperature,5|increase.,5|What,0|should,0|she,0|do,0|first?,3
Water vapor exists in the atmosphere as        (A) a visible gas. (B) a visible liquid. (C) an invisible gas. (D) an invisible liquid.	5	Water,4|vapor,5|exists,2|in,0|the,0|atmosphere,5|as,0
Automobiles move as a result of which type of energy transformation? (A) Chemical to electrical (B) Mechanical to heat (C) Chemical to mechanical (D) Kinetic to potential	5	Automobiles,5|move,4|as,0|a,0|result,0|of,0|which,0|type,2|of,0|energy,5|transformation?,5
Cancer is best described as (1) a type of genetic engineering (2) the merging of sex cells (3) abnormal cell division (4) tissue that stops growing	5	Cancer,5|is,0|best,1|described,3|as,0
How are a tree and grass alike? (A) Both make wood. (B) Both have roots. (C) Both need moonlight. (D) Both have short lives.	5	How,0|are,0|a,0|tree,5|and,0|grass,5|alike?,4
Animals eat plants or other animals. How much and what they eat affects other parts of the ecosystem. These interrelationships between the living things in an ecosystem is called ___. (A) interdependence (B) decomposition (C) environment (D) food webbing	5	Animals,1|eat,1|plants,1|or,0|other,0|animals.,1|How,0|much,1|and,0|what,0|they,0|eat,1|affects,0|other,0|parts,1|of,0|the,0|ecosystem.,1|These,0|interrelationships,4|between,0|the,0|living,4|things,4|in,0|an,0|ecosystem,4|is,0|called,2|___.,0
A shiny aluminum screen can be placed on the windshield of a parked car. This screen helps to keep the car cool because it    (A) reflects the sunlight (B) absorbs heat (C) causes evaporation (D) conducts electricity	5	A,0|shiny,1|aluminum,4|screen,5|can,0|be,0|placed,0|on,0|the,0|windshield,4|of,0|a,0|parked,2|car.,3|This,0|screen,0|helps,2|to,0|keep,3|the,0|car,4|cool,5|because,0|it,0
A research team wanted to produce a smaller variety of German shepherd dogs. They mated the smallest dogs from different litters for several generations. This is an example of which concept? (1) extinction (2) mutation (3) selective breeding (4) natural selection	5	A,0|research,1|team,1|wanted,0|to,0|produce,1|a,0|smaller,2|variety,2|of,0|German,3|shepherd,3|dogs.,3|They,0|mated,5|the,0|smallest,5|dogs,5|from,0|different,2|litters,2|for,0|several,2|generations.,4|This,0|is,0|an,0|example,3|of,0|which,0|concept?,1
An object is placed on a table. A magnet is slowly moved toward the object. The object moves away from the magnet. The object is most likely a(an) (A) copper coin. (B) piece of glass. (C) iron nail. (D) magnet.	5	An,0|object,1|is,0|placed,0|on,0|a,0|table.,1|A,0|magnet,3|is,0|slowly,0|moved,3|toward,2|the,0|object.,2|The,0|object,4|moves,3|away,4|from,0|the,0|magnet.,4|The,0|object,2|is,0|most,0|likely,1|a(an),0
How does the length of daylight in New York State change from summer to fall? (A) It decreases. (B) It increases. (C) It remains the same.	5	How,0|does,0|the,0|length,3|of,0|daylight,5|in,0|New,3|York,3|State,2|change,3|from,0|summer,5|to,0|fall?,5
Which sequence lists the levels of organization in the human body from simplest to most complex? (1) organ system -> tissue -> cell -> organ (2) tissue -> cell -> organ -> organ system (3) organ -> organ system -> tissue -> cell (4) cell -> tissue -> organ -> organ system	5	Which,0|sequence,2|lists,2|the,0|levels,5|of,0|organization,5|in,0|the,0|human,3|body,4|from,0|simplest,4|to,0|most,0|complex?,4
Which part of the plant is responsible for making food? (A) flower (B) leaves (C) stem (D) roots	5	Which,0|part,4|of,0|the,0|plant,5|is,0|responsible,1|for,0|making,3|food?,5
Which is an example of a different substance being formed?     (A) glass breaking (B) metal melting (C) water freezing (D) wood burning	5	Which,0|is,0|an,0|example,2|of,0|a,0|different,4|substance,5|being,0|formed?,5
For many years, people have been curious about the stars. In the past, people have shared what they knew about the stars through stories and drawings. Which pair of tools would be most helpful for people today to gather and share information about stars? (A) a notebook and a calculator (B) a telescope and a computer (C) a calculator and a microscope (D) a microscope and a telescope	5	For,0|many,0|years,,0|people,0|have,0|been,0|curious,1|about,0|the,0|stars.,2|In,0|the,0|past,,1|people,1|have,0|shared,1|what,0|they,0|knew,0|about,0|the,0|stars,1|through,0|stories,1|and,0|drawings.,1|Which,0|pair,2|of,0|tools,5|would,0|be,0|most,0|helpful,2|for,0|people,0|today,1|to,0|gather,4|and,0|share,4|information,4|about,0|stars?,5
An area received six inches of snow during the winter. Before the snow can continue through the water cycle as ground water or runoff, it must first ___. (A) condense (B) evaporate (C) freeze (D) melt	5	An,0|area,1|received,0|six,2|inches,2|of,0|snow,3|during,0|the,0|winter.,1|Before,0|the,0|snow,5|can,0|continue,3|through,0|the,0|water,5|cycle,5|as,0|ground,3|water,3|or,0|runoff,,3|it,0|must,2|first,2|___.,1
Each lifeform in a given environment is referred to as a(n) ___. (A) producer (B) consumer (C) nonliving factor (D) organism	5	Each,0|lifeform,4|in,0|a,0|given,4|environment,5|is,0|referred,2|to,0|as,0|a(n),0|___.,0
Which of the following processes makes it possible for plants to use energy from sunlight to produce their own food? (A) metamorphosis (B) photosynthesis (C) pollination (D) reproduction	5	Which,0|of,0|the,0|following,0|processes,3|makes,0|it,0|possible,1|for,0|plants,4|to,0|use,3|energy,5|from,0|sunlight,5|to,0|produce,3|their,0|own,0|food?,5
When a butterfly emerges from its chrysalis, its wings are crumpled. In order to expand its wings, the butterfly hangs upside down, causing fluid to be pumped into the veins of its wings. This pumping most likely expands the wings by  A increasing the pressure inside the wings B decreasing the density of the wings C increasing the temperature inside the wings D decreasing the mass of the wings	5	When,0|a,0|butterfly,3|emerges,2|from,0|its,0|chrysalis,,3|its,0|wings,2|are,0|crumpled.,2|In,0|order,0|to,0|expand,2|its,0|wings,,2|the,0|butterfly,2|hangs,4|upside,3|down,,4|causing,0|fluid,4|to,0|be,0|pumped,4|into,0|the,0|veins,3|of,0|its,0|wings.,0|This,0|pumping,4|most,0|likely,0|expands,4|the,0|wings,1|by,0|,2
Which statement correctly describes a relationship between two human body systems?	5	Which,0|statement,1|correctly,0|describes,1|a,0|relationship,5|between,0|two,3|human,3|body,4|systems?,5
Electrical energy can be converted to kinetic energy (motion) by a(n) ___. (A) parallel circuit (B) battery (C) electric motor (D) series circuit	5	Electrical,5|energy,3|can,0|be,0|converted,5|to,0|kinetic,5|energy,3|(motion),1|by,0|a(n),0|___.,0
Which two systems primarily function to rid the human body of the wastes resulting from cellular energy production?	5	Which,0|two,1|systems,4|primarily,0|function,3|to,0|rid,4|the,0|human,3|body,3|of,0|the,0|wastes,5|resulting,0|from,0|cellular,2|energy,2|production?,2
Kerry's family is building a house. They have a choice of colors for their roof. What would be the best choice of color to help keep the house warm? (A) Black (B) Gray (C) Tan (D) White	5	Kerry's,0|family,0|is,0|building,1|a,0|house.,1|They,0|have,0|a,0|choice,0|of,0|colors,1|for,0|their,0|roof.,3|What,0|would,0|be,0|the,0|best,1|choice,1|of,0|color,5|to,0|help,2|keep,4|the,0|house,4|warm?,5
When no outside forces are applied, and object at rest will ___. (A) stay at rest (B) remain in constant motion (C) slowly accelerate (D) decrease in mass	5	When,0|no,0|outside,4|forces,4|are,0|applied,,2|and,0|object,5|at,0|rest,5|will,3|___.,1
If organisms were not able to adapt to their surroundings, what would happen to them? (A) They would be less likely to survive. (B) They would all die suddenly. (C) Nothing would happen to them. (D) They would survive easily.	5	If,0|organisms,3|were,0|not,0|able,3|to,0|adapt,5|to,0|their,0|surroundings,,3|what,0|would,0|happen,3|to,0|them?,1
A plant produces tiny plants around the edges of its leaves. When these tiny plants fall to the ground, they take root and become new plants. This process is an example of (1) sexual reproduction (2) asexual reproduction (3) evolution (4) extinction	5	A,0|plant,3|produces,3|tiny,4|plants,5|around,1|the,0|edges,5|of,0|its,0|leaves.,5|When,0|these,0|tiny,1|plants,1|fall,4|to,0|the,0|ground,,1|they,0|take,3|root,4|and,0|become,1|new,2|plants.,2|This,0|process,1|is,0|an,0|example,2|of,0
Decomposers serve important roles in an ecosystem. One of the things they do is ___. (A) reduce nutrients in the soil (B) reduce insect populations (C) recycle nutrients (D) recycle water	5	Decomposers,5|serve,0|important,0|roles,4|in,0|an,0|ecosystem.,2|One,1|of,0|the,0|things,1|they,0|do,0|is,0|___.,0
When a tadpole grows, its gills change into lungs. What does it now need to survive? (A) Air (B) Water (C) Soil (D) Fins	5	When,0|a,0|tadpole,2|grows,,2|its,0|gills,5|change,4|into,0|lungs.,5|What,0|does,0|it,0|now,0|need,4|to,0|survive?,4
Genes carry (A) traits. (B) markings. (C) stories. (D) items.	5	Genes,5|carry,3
Michael Faraday showed how electric current in a wire produces    (A) molecules (B) chemicals (C) a vibration (D) a magnetic field	5	Michael,1|Faraday,2|showed,1|how,0|electric,4|current,5|in,0|a,0|wire,4|produces,5
Which term identifies a group of cells that work together to perform a similar function? (1) molecule (2) organ (3) organism (4) tissue	5	Which,0|term,2|identifies,1|a,0|group,1|of,0|cells,5|that,0|work,3|together,4|to,0|perform,3|a,0|similar,4|function?,5
Which best determines the health of a lake used as a source of freshwater? 	5	Which,0|best,0|determines,4|the,0|health,5|of,0|a,0|lake,5|used,0|as,0|a,0|source,4|of,0|freshwater?,5
An example of a predator and prey is (A) rabbit and grass (B) plant and sun (C) deer and tree bark (D) hawk and mouse	5	An,0|example,3|of,0|a,0|predator,5|and,0|prey,5|is,0
Dust and ash entering the atmosphere as a result of volcanic eruptions can affect Earth's (1) tidal activity (2) orbital shape (3) weather and climate (4) rotation and revolution	5	Dust,4|and,0|ash,4|entering,1|the,0|atmosphere,4|as,0|a,0|result,0|of,0|volcanic,5|eruptions,5|can,0|affect,5|Earth's,4
How are a tree and grass alike? (A) Both make wood. (B) Both have roots. (C) Both need moonlight. (D) Both have short lives.	5	How,0|are,0|a,0|tree,5|and,0|grass,5|alike?,3
A simple food chain includes hawks, lizards, and insects. Which will most likely happen to the lizard and hawk populations if a pesticide is sprayed to kill the insects, and the lizard and hawk populations cannot find other food in this ecosystem? (A) Both the lizard population and the hawk population will increase. (B) Both the lizard population and the hawk population will decrease. (C) The lizard population will increase, but the hawk population will decrease. (D) The lizard population will decrease, but the hawk population will increase.	5	A,0|simple,0|food,4|chain,4|includes,0|hawks,,4|lizards,,4|and,0|insects.,4|Which,0|will,1|most,0|likely,0|happen,3|to,0|the,0|lizard,4|and,0|hawk,4|populations,3|if,0|a,0|pesticide,5|is,0|sprayed,0|to,0|kill,3|the,0|insects,,3|and,0|the,0|lizard,1|and,0|hawk,1|populations,0|cannot,0|find,2|other,0|food,3|in,0|this,0|ecosystem?,0
In an attempt to prevent certain species from becoming extinct, humans have ___. (A) increased the trapping of predators (B) attempted to mate organisms from different species to create new and stronger organisms (C) placed all endangered species in zoos (D) increased wildlife management and habitat protection	5	In,0|an,0|attempt,0|to,0|prevent,5|certain,1|species,4|from,0|becoming,1|extinct,,5|humans,4|have,0|___.,0
A tuna is an ocean fish that is well adapted to catching small, fast-moving prey. Which of the following adaptations most helps a tuna swim fast to catch its prey? (A) large fins (B) sharp teeth (C) small gills (D) tough scales	5	A,0|tuna,3|is,0|an,0|ocean,1|fish,2|that,0|is,0|well,0|adapted,3|to,0|catching,2|small,,2|fast-moving,1|prey.,3|Which,0|of,0|the,0|following,0|adaptations,4|most,0|helps,4|a,0|tuna,2|swim,4|fast,4|to,0|catch,1|its,0|prey?,1
Which of these is the most responsible for the changes of the seasons on Earth? (A) Position of the Moon (B) Tilt of Earth on its axis (C) Temperature of the Sun (D) Distance to Mars	5	Which,0|of,0|these,0|is,0|the,0|most,0|responsible,3|for,0|the,0|changes,4|of,0|the,0|seasons,5|on,0|Earth?,2
The mountain chorus frog is an endangered species in Maryland. In addition to the loss of habitat, what most likely caused this frog population to decline? (A) an increase in a food source (B) more frog breeding grounds (C) native wetlands preservation (D) poisons dissolved in the water	5	The,0|mountain,1|chorus,1|frog,1|is,0|an,0|endangered,1|species,1|in,0|Maryland.,0|In,0|addition,3|to,0|the,0|loss,4|of,0|habitat,,4|what,0|most,0|likely,1|caused,4|this,0|frog,5|population,5|to,0|decline?,5
A pencil falls off of a desk. What moves the pencil toward the floor? (A) mass (B) friction (C) gravity (D) speed	5	A,0|pencil,3|falls,2|off,0|of,0|a,0|desk.,1|What,0|moves,4|the,0|pencil,3|toward,2|the,0|floor?,4
Movement of Earth's crust along plate boundaries produces (1) fronts (2) tides (3) hurricanes (4) earthquakes	5	Movement,5|of,0|Earth's,5|crust,5|along,0|plate,5|boundaries,5|produces,3
A container is filled with 250 milliliters of water. The total mass of the container and the water is 300 grams. What is the total mass of the container and the water after being in a freezer for 2 hours?    (A) 50 grams (B) 250 grams (C) 300 grams (D) 550 grams	5	A,0|container,1|is,0|filled,0|with,0|250,2|milliliters,2|of,0|water.,3|The,0|total,1|mass,3|of,0|the,0|container,2|and,0|the,0|water,2|is,0|300,4|grams.,3|What,0|is,0|the,0|total,2|mass,4|of,0|the,0|container,3|and,0|the,0|water,2|after,0|being,0|in,0|a,0|freezer,5|for,0|2,3|hours?,3
In which phase of matter do the particles have the most definitive shape? (A) gas (B) liquid (C) solid (D) None of these.	5	In,0|which,0|phase,4|of,0|matter,3|do,0|the,0|particles,5|have,0|the,0|most,0|definitive,3|shape?,5
On a warm sunny afternoon, ocean water splashed onto a rock. A short time later, the rock was dry. Which statement best explains what happened to the water on the rock? (A) Heat caused the water to become a gas. (B) Heat melted the water and it disappeared. (C) Salt caused the water to become a gas. (D) Salt melted the water and it disappeared.	5	On,0|a,0|warm,0|sunny,1|afternoon,,1|ocean,1|water,3|splashed,4|onto,1|a,0|rock.,4|A,0|short,1|time,2|later,,4|the,0|rock,4|was,0|dry.,5|Which,0|statement,2|best,0|explains,3|what,0|happened,3|to,0|the,0|water,3|on,0|the,0|rock?,0
The Moon is visible to observers on Earth because of (1) reflected sunlight (2) absorbed light from Earth's atmosphere (3) gases in the Moon's interior (4) volcanic eruptions on the Moon's surface	5	The,0|Moon,5|is,0|visible,5|to,0|observers,1|on,0|Earth,3|because,0|of,0
Which substance is usually found in nature as a liquid, solid, and gas? (A) water (B) rock (C) metal (D) glass	5	Which,0|substance,3|is,0|usually,0|found,4|in,0|nature,3|as,0|a,0|liquid,,5|solid,,5|and,0|gas?,5
Amphibians have a three-chambered heart. Humans have a four-chambered heart. In both organisms, the function of the heart is to ___. (A) coordinate activities of the body (B) pump blood around the body (C) provide energy for the organism (D) coordinate movement	5	Amphibians,2|have,0|a,0|three-chambered,1|heart.,2|Humans,2|have,0|a,0|four-chambered,1|heart.,1|In,0|both,0|organisms,,1|the,0|function,4|of,0|the,0|heart,4|is,0|to,0|___.,0
